title;average_rating;book_id;language_code
Saving Fish from Drowning;3.43;9780345464019;eng
Un Lugar Llamado Nada;3.43;9788408067016;spa
Virginia Woolf: An Inner Life;4.15;9780156032292;eng
Measure for Measure;3.68;9780141013800;eng
Henry Adams and the Making of America;3.79;9780618134304;en-US
Persepolis: The Story of a Childhood (Persepolis  #1);4.25;9780375714573;eng
Persepolis 2: The Story of a Return (Persepolis  #2);4.24;9780375714665;eng
Chicken with Plums;3.86;9780375424151;en-US
Embroideries;3.86;9780375714672;eng
The Shadow of the Wind (The Cemetery of Forgotten Books  #1);4.26;9780753820254;eng
Peter and the Shadow Thieves (Peter and the Starcatchers  #2);4.16;9780786837878;eng
Ender's Shadow (The Shadow Series  #1);4.31;9780765342409;eng
Shadow of the Hegemon (The Shadow Series  #2);3.95;9780812565959;eng
Shadow Dance (Buchanan-Renard  #6);4.0;9780345453860;eng
The Shadow Rising (The Wheel of Time  #4);4.24;9780812513738;eng
The Shadow Party: How George Soros  Hillary Clinton  and Sixties Radicals Seized Control of the Democratic Party;4.2;9781595550446;en-US
Cast in Shadow (Chronicles of Elantra  #1);3.79;9780373802548;eng
Owning Your Own Shadow: Understanding the Dark Side of the Psyche;4.04;9780062507549;eng
In Praise of Shadows;4.09;9780099283577;eng
Shadow of the Almighty: The Life and Testament of Jim Elliot;4.4;9780060622138;eng
Shadow Game (GhostWalkers  #1);4.12;9780515135961;eng
The Elephant Vanishes;3.86;9780099448754;eng
Sputnik Sweetheart;3.83;9780099448471;eng
Back to Wando Passo;3.25;9780060851897;en-US
Still Life with Woodpecker;4.05;9781842430224;eng
Half Asleep in Frog Pajamas;3.74;9781842430361;eng
Fierce Invalids Home from Hot Climates;4.03;9780553107753;en-US
PanAroma: Jitterbug Perfume;4.25;9783499156717;ger
Ein Platz für Hot Dogs: Another Roadside Attraction;3.98;9783499154294;ger
Halbschlaf im Froschpyjama;3.74;9783499224423;ger
God Bless You  Mr. Rosewater;3.96;9780385333474;eng
Wampeters  Foma and Granfalloons;3.79;9780385333818;en-US
Mother Night;4.22;9780385334143;eng
Galápagos;3.88;9780385333870;eng
Timequake;3.72;9780099267546;eng
Slapstick  or Lonesome No More!;3.87;9780385334235;eng
Like Shaking Hands with God: A Conversation About Writing;3.72;9780743410588;en-US
Palm Sunday: An Autobiographical Collage;3.77;9780385334266;eng
Sun  Moon  Star;3.78;9780060263195;eng
Cat's Cradle/God Bless You Mr. Rosewater/Breakfast of Champions;4.36;9780517124369;eng
Bradbury Stories: 100 of His Most Celebrated Tales;4.41;9780060544881;eng
Farewell Summer (Green Town  #3);3.72;9780061131547;eng
Classic Stories 1: The Golden Apples of the Sun/R is for Rocket;4.21;9780553286373;eng
Dandelion Wine;4.09;9780380977260;en-US
The Homecoming;4.08;9780060859626;en-US
Zen in the Art of Writing: Essays on Creativity;4.1;9781877741098;en-US
Switch on the Night;4.13;9780553112443;en-US
The Best of Ray Bradbury;4.07;9780743474764;eng
The Bradbury Chronicles: The Life of Ray Bradbury;4.24;9780060545840;en-US
The Cat's Pajamas;3.73;9780060777333;eng
Essays;4.33;9780375415036;eng
Why I Write;4.03;9780143036357;eng
Homage to Catalonia;4.14;9780156421171;eng
Keep the Aspidistra Flying;3.88;9780141183725;eng
The Orwell Reader: Fiction  Essays  and Reportage;4.38;9780156701761;eng
If on a Winter's Night a Traveler;4.05;9780679420255;eng
Parachutes & Kisses;3.46;9781585425006;eng
Fear of Fifty: A Midlife Memoir;3.55;9781585425242;eng
How to Save Your Own Life: An Isadora Wing Novel;3.6;9781585424993;eng
Any Woman's Blues;3.51;9781585425495;eng
What Do Women Want?: Essays by Erica Jong;3.69;9781585425549;eng
Fanny: Being the True History of the Adventures of Fanny Hackabout-Jones;3.79;9780393324358;eng
Serenissima aka Shylock's Daughter;3.29;9780440201045;eng
Dogeaters;3.59;9781559362153;eng
Crescent and Star: Turkey Between Two Worlds;3.84;9780374528669;eng
Love in the Time of Cholera;3.91;9781400034680;eng
El amor en los tiempos del cólera;3.91;9789500703208;spa
Gabriel Garcia Marquez's Love in the Time of Cholera: A Reader's Guide;4.24;9780826414755;eng
The Unbearable Lightness of Being;4.1;9780571224388;eng
Obasan;3.64;9780385468862;eng
Ender's Game Boxed Set: Ender's Game  Ender's Shadow  Shadow of the Hegemon;4.49;9780765344953;en-US
Speaker for the Dead (Ender's Saga  #2);4.07;9780812532579;eng
The Audacity of Hope: Thoughts on Reclaiming the American Dream;3.75;9780307237699;eng
Mao: The Unknown Story;3.83;9780679746324;eng
The Art of War;4.2;9780976072676;eng
Oracle Bones: A Journey Between China's Past and Present;4.18;9780060826581;eng
Wild Swans: Three Daughters of China;4.26;9780007176151;eng
The Wild Swans;3.67;9780446608473;eng
Women in Love;3.67;9780486424583;eng
Women Who Love Too Much;4.02;9780099474128;eng
Men Who Hate Women and the Women Who Love Them: When Loving Hurts and You Don't Know Why;4.09;9780553381412;eng
A Walk in the Woods: Rediscovering America on the Appalachian Trail;4.06;9780767902526;eng
A Walk in the Woods: Rediscovering America on the Appalachian Trail;4.06;9780307279460;eng
A Walk in the Woods (Stickerific);3.5;9780736411035;eng
The Fortress of Solitude;3.88;9780571219353;eng
Fortress of Solitude / The Devil Genghis;3.99;9781932806496;eng
Our Ancestors: The Cloven Viscount  The Baron in the Trees  The Non-Existent Knight;4.27;9780330261562;eng
Difficult Loves;3.94;9780156260558;en-US
The Nonexistent Knight & The Cloven Viscount;4.03;9780156659758;en-US
The View from Castle Rock;3.68;9781400042821;eng
The View From Castle Rock;3.68;9780771065262;eng
Crossing to Safety;4.16;9780375759314;eng
Oh Rats! The Story of Rats and People;3.77;9780525477624;eng
King Rat (Asian Saga  #4);4.14;9780385333764;eng
Rat Bastards: The Life and Times of South Boston's Most Honorable Irish Mobster;3.51;9780060837167;eng
Julius Knipl  Real Estate Photographer: The Beauty Supply District;4.35;9780375700989;eng
Blind Willow  Sleeping Woman: 24 Stories;3.84;9781400102952;eng
Blind Willow  Sleeping Woman;3.84;9781400044610;eng
The Bookseller of Kabul;3.77;9780316159418;en-US
Jasmine and Stars: Reading More Than Lolita in Tehran;3.63;9780807831090;en-US
Making Globalization Work;3.85;9780393061222;eng
Prep : A Novel;3.38;9780812972351;eng
Tan fuerte  tan cerca;3.98;9788426415165;eng
The Wizard of Oz;4.0;9780851703008;eng
The Ground Beneath Her Feet;3.79;9780312254995;eng
The Moor's Last Sigh;3.93;9780099592419;eng
Los Versos Satánicos;3.71;9788497598361;spa
Dangling Man;3.54;9780140189353;eng
Grimus;3.41;9780812969993;eng
Breakfast at Tiffany's;3.89;9780140274110;eng
Jesus' Son;4.09;9780413772428;eng
Angels;3.72;9780099440833;eng
The Throne of the Third Heaven of the Nations Millennium General Assembly: Poems Collected and New;4.15;9780060926960;eng
The Stars at Noon;3.58;9780060976101;eng
The Rules of Attraction;3.68;9780679781486;eng
Glamorama;3.46;9780375703843;eng
Less Than Zero;3.58;9780679781493;eng
A Christmas Memory;4.24;9780375837890;eng
In Cold Blood;4.07;9780375507908;eng
The Southern Haunting of Truman Capote;3.9;9781581821369;eng
Summer Crossing;3.44;9780812975932;eng
Answered Prayers;3.49;9780141185934;eng
The Grass Harp  Including A Tree of Night and Other Stories;4.01;9780679745570;eng
From Babylon to Timbuktu: A History of the Ancient Black Races Including the Black Hebrews;4.31;9780962088117;eng
Cruelest Journey: Six Hundred Miles To Timbuktu;3.93;9780792274575;eng
Between Time and Timbuktu or Prometheus-5;3.46;9780385280792;eng
Murder in Amsterdam: The Death of Theo van Gogh and the Limits of Tolerance;3.72;9781594201080;eng
The Cement Garden;3.54;9780099468387;eng
Atonement;3.9;9780099429791;eng
Gertrud The Great Of Helfta: Spiritual Exercises;3.43;9780879074494;eng
Gertrud;3.85;9783518373903;ger
Der Prozess;3.98;9780805232110;ger
Naokos Lächeln;4.03;9783442730506;ger
The Ruined Map;3.55;9780375726521;eng
The Face of Another;3.78;9780375726538;eng
Three Plays: Involuntary Homicide / The Green Stockings / The Ghost is Here;3.91;9780231082815;eng
Secret Rendezvous;3.61;9780375726545;eng
Oracle Night;3.78;9780965913225;eng
Eleanor Rigby;3.65;9781582346434;eng
Homo Faber;3.74;9780156421355;eng
Erläuterungen Zu Max Frisch  Homo Faber;3.6;9783804417830;ger
Homo faber: Ein Bericht.;3.74;9783458340447;ger
The Philosophy of Jean-Paul Sartre;3.89;9781400076321;eng
Being and Nothingness;3.96;9780415278485;eng
The Age of Reason;3.98;9780679738954;eng
Die Entdeckung der Langsamkeit;3.95;9783492207003;ger
Youth in Revolt: The Journals of Nick Twisp;4.02;9780385481960;eng
And I Don't Want to Live This Life: A Mother's Story of Her Daughter's Murder;4.1;9780449911419;eng
Sid and Nancy: Love Kills;3.48;9780571145454;eng
Flags of Our Fathers;4.19;9780553384154;eng
Flags of Our Fathers: A Young People's Edition;4.17;9780440229209;eng
A Long Way Down;3.42;9781594481932;eng
Clockwork (Cover to Cover);3.87;9781855496958;eng
Mary Queen of Scots;4.05;9780385311298;eng
Mary Queen of Scots and the Murder of Lord Darnley;4.04;9780712664561;eng
On the Trail of Mary  Queen of Scots;3.25;9780946487509;eng
River of Blue Fire (Otherland  #2);4.02;9780886778446;eng
Mary  Queen of Scots: Queen Without a Country;3.83;9780439194044;eng
Mountain of Black Glass (Otherland  #3);4.05;9780886779061;eng
Mary  Queen of Scots: Pride  Passion and a Kingdom Lost;3.72;9781860645884;eng
Queen of Scots: The True Life of Mary Stuart;3.93;9780618254118;eng
The Last Wife of Henry VIII;3.89;9780312352189;en-US
The Children of Henry VIII;4.05;9780345407863;eng
The Last Days of Henry VIII;4.14;9780060837334;eng
The Autobiography of Henry VIII: With Notes by His Fool  Will Somers;4.26;9780312194390;eng
Henry VIII (Shakespeare  Pelican);3.54;9780140714753;eng
The Memoirs of Cleopatra;4.18;9780330353823;eng
Saint George and the Dragon;4.18;9780316367950;eng
Kiss Me Like a Stranger: My Search for Love and Art;3.9;9780312337070;eng
Wie ich eines schönen Morgens im April das 100%ige Mädchen sah;3.8;9783499222504;ger
The Complete Sherlock Holmes  Volume I;4.49;9781593080341;eng
The Complete Sherlock Holmes  Volume II;4.47;9781593080402;eng
The Last of Her Kind;3.72;9780312425944;eng
Anatomy of Love: A Natural History of Mating  Marriage  and Why We Stray;3.94;9780449908976;en-US
The Devil's in the Details (A Camilla MacPhee Mystery  #4);4.0;9781894917124;eng
Wigfield: The Can-Do Town That Just May Not;3.58;9781565117723;eng
The SantaLand Diaries and Season's Greetings;4.18;9780822216315;eng
Jenny and the Jaws of Life: Short Stories;3.74;9780312306182;en-US
"Venac sonetnih venaca; Puževa srma";0.0;9788644101277;srp
View With a Grain of Sand: Selected Poems;4.33;9780156002165;eng
View with a Grain of Sand: Selected Poems;4.33;9780571191635;eng
Poems New and Collected;4.43;9780156011464;eng
Sounds  Feelings  Thoughts:  Seventy Poems by Wislawa Szymborska;4.36;9780691013800;eng
Miracle Fair: Selected Poems;4.42;9780393323856;eng
Jane Eyre;4.12;9780142437209;eng
The Far Pavilions;4.21;9780517333419;eng
Death in Kashmir;3.95;9780312263102;eng
The Sun in the Morning: My Early Years in India and England;4.22;9780312049997;en-US
Death in the Andamans;3.93;9780312252816;eng
Death in Berlin;3.89;9780312263089;eng
The Far Pavilions;4.21;9780312151256;en-US
Enchanted Evening;4.38;9780312265816;eng
Pathologies of Power: Health  Human Rights and the New War on the Poor;4.25;9780520243262;eng
Infections and Inequalities: The Modern Plagues;4.09;9780520229136;eng
Mountains Beyond Mountains: The Quest of Dr. Paul Farmer  a Man Who Would Cure the World;4.21;9780812973013;eng
The Tao of Physics: An Exploration of the Parallels between Modern Physics and Eastern Mysticism;3.97;9781570625190;eng
Dr. Mary's Monkey: How the Unsolved Murder of a Doctor  a Secret Laboratory in New Orleans and Cancer-Causing Monkey Viruses are Linked to Lee Harvey Oswald  the JFK Assassination and Emerging Global Epidemics;3.92;9780977795306;eng
The Art of Richard P. Feynman;4.31;9782884490474;en-US
The Early History of God: Yahweh and the Other Deities in Ancient Israel;4.03;9780802839725;eng
Haiti  History  and the Gods;3.95;9780520213685;eng
Acts of God: The Unnatural History of Natural Disaster in America;3.72;9780195309683;eng
The World's Religions;4.07;9780062508119;eng
Introduction to World Religions;3.78;9780800637149;eng
FDR's Folly: How Roosevelt and His New Deal Prolonged the Great Depression;4.0;9781400054770;eng
Folly and Glory (The Berrybender Narratives  #4);3.87;9780743262729;en-US
The Argumentative Indian: Writings on Indian History  Culture and Identity;3.8;9780312426026;eng
Argumentative Indian: Writings On Indian History Culture And Identity;3.8;9780713996876;eng
Things to Bring  S#!t to Do: And Other Inventories of Anxiety: My Life in Lists;3.67;9781584795421;eng
Dumpy's Valentine;3.31;9780060885731;eng
Mandy;4.24;9780061131622;eng
Giraffes Can't Dance;4.3;9781846162664;eng
The Medici Giraffe and Other Tales of Exotic Animals and Power;3.53;9780316525657;eng
The Giraffe Who Was Afraid of Heights (Physical & Behavioral Adaptation);3.87;9780976882305;eng
Where the Red Fern Grows with Connections;4.37;9780030547744;eng
Summer of the Monkeys;4.03;9780440415800;eng
Dreams from My Father: A Story of Race and Inheritance;3.88;9780307383419;en-US
Doctor Who: Cat's Cradle-Time's Crucible;3.22;9780426203650;eng
Doctor Who: Cat's Cradle-Witch Mark;3.22;9780426203681;eng
Doctor Who: Cat's Cradle-Warhead;3.51;9780426203674;eng
He's Just Not That Into You: The No-Excuses Truth to Understanding Guys;3.66;9781416947400;eng
Do Not Open This Book;3.9;9780439698399;eng
Not Your Mother's Slow Cooker Cookbook;3.78;9781558322455;en-US
Hands Are Not for Hitting (Ages 4-7);4.04;9781575420776;eng
Not So Big House;4.07;9781561583768;eng
Rodinsky's Room;3.85;9781862073296;eng
The Rough Guide to Cuba 3;3.82;9781843534099;eng
Cuba: A New History;4.06;9780300111149;en-GB
Cuba 15;3.45;9780385732338;eng
Cuba (Jake Grafton #7);3.82;9780312971397;eng
The Memory Keeper's Daughter;3.67;9780143037149;eng
Too Far to Go: The Maples Stories;4.02;9780449200162;eng
Far to Go (Margaret Thursday  #2);3.81;9780440424949;eng
The Children on the Top Floor;3.79;9780440412243;en-GB
Desolation Angels;3.93;9781573225052;eng
Healing With Whole Foods: Asian Traditions and Modern Nutrition;4.41;9781556434303;en-US
The New Whole Foods Encyclopedia: A Comprehensive Resource for Healthy Eating;4.2;9780140250329;eng
The Discomfort Zone: A Personal Journey;3.4;9781598870541;en-US
The Parrot's Lament  and Other True Tales of Animal Intrigue  Intelligence  and Ingenuity;3.93;9780452280687;eng
Postscript to the Name of the Rose;4.05;9780151731565;eng
El nombre de la rosa;4.12;9788497592581;spa
Baby Names for Dummies;3.32;9780764543401;eng
The Mysterious Flame of Queen Loana;3.35;9780156030434;eng
History of Beauty;3.78;9780847826469;eng
Baudolino;3.74;9780156029063;eng
Travels in Hyperreality;3.89;9780156913218;eng
How to Travel with a Salmon and Other Essays;3.85;9780156001250;eng
A Theory of Semiotics;4.01;9780253202178;eng
Art and Beauty in the Middle Ages;3.99;9780300093049;en-US
Mouse or Rat?: Translation as Negotiation;3.8;9780753817988;eng
The Role of the Reader: Explorations in the Semiotics of Texts;4.06;9780253203182;eng
Libraries;4.28;9783829601863;eng
The Art of War;3.97;9781590302255;eng
"Sun Tzu: The Art of War for Managers; 50 Strategic Rules";3.8;9781580624596;eng
The Art of War;3.97;9781402561016;eng
The Lost Continent:  Travels in Small-town America;3.83;9780552998086;eng
Made in America: An Informal History of the English Language in the United States;3.91;9780380713813;eng
Ulysses;3.73;9780141182803;en-US
The Long-Lost Map (Ulysses Moore #2);4.0;9780439774390;eng
The Wicked Wit of Charles Dickens;3.55;9781854790477;eng
The Three Musketeers;4.07;9781593081485;eng
The Three Musketeers;4.07;9781596009707;eng
The Three Musketeers (Great Illustrated Classics);4.08;9781577658030;eng
The Three Musketeers (The d'Artagnan Romances. #1);4.07;9781853260407;eng
Lisey's Story;3.68;9780743289412;eng
King Arthur Flour Whole Grain Baking: Delicious Recipes Using Nutritious Whole Grains;4.13;9780881507195;eng
King Dork (King Dork  #1);3.56;9780385732918;eng
A Clash of Kings  (A Song of Ice and Fire  #2);4.41;9780553381696;eng
The Colorado Kid;3.32;9780843955842;eng
Stationary Bike;3.54;9780743555616;eng
Everything's Eventual: 14 Dark Tales;3.97;9781416524359;eng
The Mist;3.95;9780671874759;eng
Pet Sematary;3.98;9781416524342;eng
Insomnia;3.82;9788497597722;spa
The Stephen King Collection: Stories from Night Shift;4.0;9780739317365;eng
The Man in the Black Suit: 4 Dark Tales;3.78;9780743525855;eng
The Shining;4.22;9780743537001;eng
Stephen King: America's Best-Loved Boogeyman;3.78;9780836254273;en-US
The Illustrated Stephen King Trivia Book;4.23;9781587671166;eng
Gray Matter and Other Stories from Night Shift;3.93;9780553471830;eng
Cujo;3.71;9780307348241;spa
Thinner;3.71;9780451190758;eng
Stephen King from A to Z: An Encyclopedia of His Life and Work;3.83;9780836269147;eng
Black House (The Talisman  #2);4.01;9780345470638;eng
The Stephen King Universe: A Guide to the Worlds of the King of Horror;4.15;9781580631600;en-US
Night Shift;4.0;9780451170118;en-US
Misery;4.16;9780450417399;eng
The Bachman Books;4.11;9780452277755;eng
Misery;4.16;9780743233590;spa
Carrie;3.96;9780671039721;eng
"Four Past Midnight: Featuring ""The Langoliers""";3.93;9780451185976;eng
Christine;3.77;9782253147695;fre
Sam Walton: Made In America;4.15;9780553562835;eng
The Road to Reality: A Complete Guide to the Laws of the Universe;4.11;9780679776314;eng
The Paradox of Choice: Why More Is Less;3.85;9780060005696;eng
Coach: Lessons on the Game of Life;3.82;9780393060911;en-US
Losers: The Road to Everyplace But the White House;3.87;9780679768098;en-US
Next: The Future Just Happened;3.67;9780393323528;en-US
The Ends of the Earth: A Journey to the Frontiers of Anarchy;4.12;9780679751236;eng
Salvation to the Ends of the Earth: A Biblical Theology of Mission (New Studies in Biblical Theology (InterVarsity Press)  #11);3.93;9780851115191;eng
The Ends Of The Earth: A Journey At The Dawn Of The 21st Century;4.12;9780679431480;eng
When Genius Failed: The Rise and Fall of Long-Term Capital Management;4.19;9780375758256;eng
When Genius Failed: The Rise And Fall Of Long Term Capital Management;4.19;9781841155043;eng
The Secret of Fantasy Forest (Sweet Valley Kids #67);3.94;9780553483321;eng
Pearl and Wagner: Three Secrets;3.84;9780803725744;eng
A History of Britain: The Fate Of Empire 1776-2000 (A History of Britain  #3);4.06;9780786868995;en-US
The Devil in the White City Murder  Magic and Madness at the Fair that Changed America;3.99;9780385602051;eng
O Historiador;3.78;9788573027105;por
Kim;3.72;9781593081928;eng
Birds Without Wings;4.16;9780436205491;eng
God Knows;3.8;9780684841250;eng
Picture This;3.68;9780684868196;en-US
Closing Time;3.02;9780743239806;eng
Good as Gold;3.36;9780684839745;eng
Something Happened;3.52;9780684841212;eng
Archie Americana Series: Best of the Eighties  Vol. 1;3.91;9781879794061;eng
The Moviegoer;3.68;9780375701962;eng
Wicked: The Life and Times of the Wicked Witch of the West;3.53;9780060745905;en-US
Wicked: Memorias de una bruja mala (Los años malvados  #1);3.53;9780061351396;spa
The Sword and the Shield: The Mitrokhin Archive & the Secret History of the KGB;3.93;9780465003129;en-US
Lay Down My Sword And Shield (Hackberry Holland  #1);3.89;9780752842691;eng
Sword and Shield;4.0;9781560764984;eng
A Year in the Merde;3.54;9781582346175;en-US
Merde!: The Real French You Were Never Taught at School;3.96;9780684854274;eng
Merde Encore!: More of the Real French You Were Never Taught at School;3.96;9780684854281;eng
Can't Wait to Get to Heaven;3.91;9781415930687;eng
Green Hills of Africa;3.56;9780099460954;eng
Across the River and into the Trees;3.33;9780684844640;eng
Hemingway: The Paris Years;4.17;9780393318791;eng
Adios Hemingway;3.72;9781841957951;eng
By-Line: Selected Articles and Dispatches of Four Decades;3.96;9780684839059;en-US
The Hemingway Women: Those Who Love Him - The Wives And Others;4.17;9780393318357;eng
Hemingway: A Biography;4.0;9780306808906;eng
The Sword of Straw (The Sangreal Trilogy  #2);3.81;9780345460806;eng
A Farewell to Arms;3.8;9780743564373;eng
A Farewell to Arms;3.8;9780684174693;eng
The Big Rock Candy Mountain;4.15;9780140139396;eng
Beyond the Hundredth Meridian: John Wesley Powell and the Second Opening of the West;4.07;9780140159943;eng
Collected Stories;4.22;9780143039792;eng
All the Little Live Things;4.09;9780140154412;eng
Where the Bluebird Sings to the Lemonade Springs;4.1;9780375759321;eng
Wallace Stegner: His Life and Work;4.19;9780140247961;eng
Letters of E.B. White;4.13;9780060757083;eng
Here Is New York;4.3;9781892145024;eng
Charlotte's Web;4.17;9780061228742;eng
Charlotte's Web;4.17;9780140364491;eng
Che Guevara: A Revolutionary Life;4.12;9780802135582;eng
Gatsby's Girl;3.54;9780618537259;en-US
In Search of Captain Zero: A Surfer's Road Trip Beyond the End of the Road;3.89;9781585421770;eng
Pipe Dream (Strivers Row);3.97;9780375756603;eng
The Pleasure of My Company;3.78;9780786888016;eng
Shopgirl;3.43;9780786891078;eng
The Mutineer: Rants  Ravings  and Missives from the Mountaintop  1977-2005;4.08;9780684873176;eng
Generation of Swine: Tales of Shame and Degradation in the '80's;3.78;9780743250443;eng
The Gonzo Way: A Celebration of Dr. Hunter S. Thompson;3.96;9781555916220;en-US
The Proud Highway: Saga of a Desperate Southern Gentleman  1955-1967;4.14;9780345377968;eng
Einstein: His Life and Universe;4.11;9780743264730;eng
The Wise Men: Six Friends and the World They Made;4.07;9780684837710;eng
Kissinger;3.94;9780743286978;eng
Traveling Mercies: Some Thoughts on Faith;4.16;9780385496094;eng
Where Rainbows End;3.94;9780007189953;eng
Irish Girls Are Back in Town;3.74;9780743499262;eng
There's No Place Like Here;3.67;9781401301880;eng
Final Rain (The Survivalist  #19);3.69;9780821726846;eng
The Pursuit of Happyness;4.19;9780060744878;eng
Harvesting the Heart;3.6;9780140230277;eng
The Tenth Circle;3.5;9780743496711;eng
Mercy;3.58;9780743422444;eng
Picture Perfect;3.54;9780425185506;eng
Songs of the Humpback Whale;3.2;9780743431019;eng
Salem Falls;3.82;9780743418713;eng
The Pact;4.01;9780061150142;eng
My Sister's Keeper;4.07;9780743454537;eng
Cold Mountain;3.86;9780802142849;eng
The Collected Songs of Cold Mountain;4.41;9781556591402;eng
For One More Day;4.1;9781401303273;eng
Just One More Day: A Memoir;3.98;9780099486831;eng
Ya Sé Que Te Quiero;4.19;9780060845988;spa
Absolutely Mahvelous;3.79;9780399512469;eng
The Last Innocent Man;3.91;9780060739683;eng
Outlander (Outlander  #1);4.23;9780440242949;eng
A Breath of Snow and Ashes (Outlander  #6);4.44;9780385340397;eng
Outlander - The Exile of Sharad Hett (Star Wars: Ongoing  Volume 2);3.43;9781569715147;eng
The Fiery Cross (Outlander  #5);4.27;9780440221661;eng
Refuge (Outlanders  #36);3.93;9780373638499;eng
Dragonfly in Amber (Outlander  #2);4.32;9780385302319;eng
Outlander;3.85;9781844164110;eng
Hydra's Ring (Outlanders  #39);3.88;9780373638529;eng
Omega Path (Outlanders  #4);3.87;9780373638178;en-US
Savage Sun (Outlanders  #3);3.84;9780373638161;en-US
As I Lay Dying;3.71;9780375504525;eng
Novels  1926-1929;4.42;9781931082891;eng
Light in August;3.94;9780679732266;eng
Novels 1942–1954: Go Down  Moses / Intruder in the Dust / Requiem for a Nun / A Fable;4.44;9780940450851;eng
Selected Short Stories;4.09;9780679424789;eng
Three Famous Short Novels: Spotted Horses Old Man the Bear;3.86;9780394701493;eng
The Town;4.1;9780394701844;eng
Voyager (Outlander  #3);4.39;9780385335997;eng
Drums of Autumn (Outlander  #4);4.35;9780385335980;eng
The Outlandish Companion: Companion to Outlander  Dragonfly in Amber  Voyager  and Drums of Autumn;4.08;9780385324137;eng
Lord John and the Private Matter (Lord John Grey  #1);3.7;9780770429454;eng
Cross Stitch (Outlander  #1);4.23;9780099911708;eng
The Eight;3.91;9780345419088;eng
Your Eight Year Old: Lively and Outgoing;3.86;9780440506812;eng
Eight Mindful Steps to Happiness: Walking the Buddha's Path;4.3;9780861711765;eng
Eight Men Out: The Black Sox and the 1919 World Series;4.03;9780805065374;en-US
Eleven on Top (Stephanie Plum  #11);4.16;9780312985349;eng
El Clan Del Oso Cavernario;4.05;9789684581142;spa
The Portable James Joyce;4.17;9780517618875;eng
Dubliners;3.85;9780192839992;eng
Finnegans Wake;3.67;9780571217359;eng
Jane Eyre;4.12;9780141441146;eng
Jane Eyre;4.12;9780393975420;eng
Jane Eyre;4.06;9780679886181;eng
Purity of Blood (Adventures of Captain Alatriste  #2);3.75;9780452287983;eng
Barnaby Rudge;3.81;9780140437287;eng
No me cogeréis vivo: artículos 2001-2005;4.16;9788420469430;spa
The Flanders Panel;3.79;9780156029582;eng
The Seville Communion;3.68;9780156029810;eng
Little Birds;3.72;9780156029049;eng
The Diary of Anaïs Nin  Vol. 2: 1934-1939;4.18;9780156260268;eng
"Henry and June: From ""A Journal of Love"": The Unexpurgated Diary of Anaïs Nin  1931-1932";3.9;9780156400572;eng
House of Incest;3.8;9780804001489;eng
The Diary of Anaïs Nin  Vol. 3: 1939-1944;4.18;9780156260275;eng
The Spectator Bird;3.99;9780140139402;eng
The Big Book of Boy Stuff;4.23;9781586853334;eng
The Boys of Everest: Chris Bonington and the Tragedy of Climbing's Greatest Generation;3.86;9780786715794;eng
Roald Dahl: The Storyteller (Famous Lives);4.06;9780750244916;eng
Les Nouvelles Recettes irrésistibles de Roald Dahl;4.14;9782070536283;fre
Relatos de lo inesperado;4.18;9788433920867;spa
Konfetti Ungemütliches + Ungezogenes;3.59;9783499158476;ger
The Sex Lives of Cannibals: Adrift in the Equatorial Pacific;3.87;9780767915304;eng
The Read-Aloud Handbook;4.41;9780143037392;eng
The Working Poor: Invisible in America;4.03;9780375708213;eng
First Comes Love (Hot Water  California #1);3.81;9780380818952;en-US
Eat Right 4 Your Type;3.57;9780712677165;en-US
The Annotated Gulliver's Travels;3.57;9780517539491;eng
Gulliver's Travels;3.57;9780393099416;eng
The Chronicles of Narnia CD Box Set;4.26;9780694524754;eng
The Chronicles of Narnia (The Chronicles of Narnia  #1-7);4.26;9780060765453;eng
