title;average_rating;book_id;language_code
The Nightmare Room: The Nightmare Begins! (The Nightmare Room  #1-3);3.88;9780060766740;en-US
The Parallax View;4.0;9780262240512;eng
Looking Awry: An Introduction to Jacques Lacan through Popular Culture;4.04;9780262740159;eng
The Puppet and the Dwarf: The Perverse Core of Christianity;3.85;9780262740258;eng
Zizek: A Critical Introduction;3.46;9780745622088;eng
Conversations with Žižek;3.88;9780745628974;eng
Marcovaldo;3.89;9780156572040;eng
The Uses of Literature;4.07;9780156932509;eng
Please Stop Laughing at Me... One Woman's Inspirational Story;3.85;9781580628365;en-US
In the Beginning...Was the Command Line;3.8;9780380815937;en-US
The Extraordinary Cases of Sherlock Holmes;4.21;9780140367058;eng
Confessions of an Ugly Stepsister;3.53;9780060987527;en-US
Jane Austen For Dummies;4.03;9780470008294;eng
The Rediscovery of Man;4.14;9781857988192;eng
Homicide: A Year on the Killing Streets;4.38;9780805080759;eng
The Corner: A Year in the Life of an Inner-City Neighborhood;4.43;9780767900317;eng
El Libertador: Writings of Simón Bolívar;3.84;9780195144819;eng
Hands Collected: The Books of Simon Perchik;4.25;9781886350854;eng
Morgoth's Ring (The History of Middle-Earth  #10);4.13;9780395680926;eng
The War of the Jewels (The History of Middle-Earth  #11);3.93;9780395710418;eng
The Silmarillion;3.92;9780261102422;eng
The Sillymarillion: An Unauthorized Parody of J.R.R. Tolkien's Classic the Silmarillion;3.54;9781593600259;eng
The Silmarillion;3.92;9780048231536;eng
Hayao Miyazaki: Master of Japanese Animation;3.93;9781880656419;en-US
Cliffs Notes on Frank's The Diary of Anne Frank;4.32;9780822003908;eng
The Honourable Schoolboy;3.95;9780743457910;eng
Valparaiso;3.33;9780330426947;eng
No More Water in the Tub!;3.95;9780140564303;eng
Big Red Tub;4.03;9780439672320;eng
Tabby in the Tub (Animal Ark  #29);3.96;9780439343909;eng
June Bug (Murder-by-Month Mystery #2);3.56;9780738709123;eng
Wickett's Remedy;3.27;9781400078127;eng
I Am the Messenger;4.07;9780375836671;eng
Getting the Girl (Wolfe Brothers  #3);3.7;9780439389501;eng
The Book Thief;4.37;9780375831003;eng
Fighting Ruben Wolfe (Wolfe Brothers  #2);3.84;9780439241878;eng
Underdog (Wolfe Brothers  #1);3.38;9783473352340;eng
Nicomachean Ethics;3.94;9780023895302;en-US
The Nicomachean Ethics;3.94;9780140449495;eng
Nicomachean Ethics;3.94;9780911589030;eng
Madame Bovary;3.67;9780140449129;eng
Madame Bovary (Critical Editions);3.67;9780393979176;en-US
Madame Bovary;3.67;9781400132744;eng
The Complete Works: The Revised Oxford Translation  Vol. 1;4.43;9780691099507;eng
Politics;3.94;9780486414249;eng
Aristotle's Ethics (SparkNotes Literature Guides);3.0;9781586638221;eng
The Politics and The Constitution of Athens;3.98;9780521484008;eng
Middlemarch;3.96;9781593080235;eng
Middlemarch;3.96;9780141804514;eng
Silas Marner;3.64;9781591940487;eng
1984;4.18;9789685270885;spa
The Complete Tales of Nikolai Gogol  Volume 1;4.32;9780226300689;en-US
The Overcoat and Other Short Stories;4.21;9780486270579;rus
The Nose;3.89;9780688104641;eng
Dead Souls;3.99;9781400043194;eng
Fathers and Sons;3.96;9780451529695;eng
Father to Son  (The Destroyer  #129);4.11;9780373632442;eng
Children of the Star (Children of the Star  #1-3);4.24;9781892065148;eng
From Far Away;4.0;9781550373967;eng
From Far Away  Vol. 01;4.31;9781591165996;eng
Silos  Politics and Turf Wars: A Leadership Fable about Destroying the Barriers That Turn Colleagues Into Competitors;4.05;9780787976385;eng
Moral Politics: How Liberals and Conservatives Think;4.03;9780226467719;eng
'Salem's Lot;4.02;9780743536950;en-US
El misterio de Salem's Lot;4.02;9788484504795;spa
'Salem's Lot;4.02;9780451098276;eng
Prodigal Blues;4.25;9781587671098;eng
The Divine Comedy  Vol. I: Inferno;4.0;9780140444414;eng
The Divine Comedy I: Hell;4.0;9780140440065;eng
The Divine Comedy  Vol. 1: Inferno;4.0;9780142437223;eng
Could Do Better: Why Children Underachieve and What to Do About It;3.8;9780471158479;eng
Inferno;4.0;9780553213393;eng
Purgatorio (La Divina Commedia #2);4.02;9780195087451;ita
Dante Alighieri's Divine Comedy  the Inferno;4.0;9780812034110;en-US
The Portable Dante;4.22;9780142437544;eng
Purgatorio (The Divine Comedy  #2);4.02;9780553213447;eng
The Divine Comedy  Vol. 3: Paradise;3.95;9780140444438;eng
The Divine Comedy  Vol. 2: Purgatory;4.02;9780140444421;eng
Vita Nuova;3.87;9780253201621;eng
The Rime of the Ancient Mariner and Other Poems;3.94;9780486272665;eng
Beowulf;3.44;9780451527400;eng
Beowulf: A Dual-Language Edition;3.44;9781400096220;eng
Beowulf: A New Telling;3.5;9780440905608;eng
Beowulf;3.85;9780763632069;eng
Seamus Heaney;4.07;9780674002050;eng
The Spirit Level: Poems;4.14;9780374525118;eng
New Selected Poems 1966-1987;4.19;9780571143726;eng
Finders Keepers: Selected Prose  1971-2001;4.15;9780571210916;en-GB
Canopy: A Work for Voice and Light in Harvard Yard;0.0;9780916724948;eng
Electric Light;3.94;9780571207985;en-GB
Norden;4.09;9783446187498;ger
Norte;4.09;9788475173467;spa
The Odyssey;3.76;9781857150940;eng
Paradise Lost;3.82;9780393962932;eng
Tolkien: The Illustrated Encyclopaedia;4.13;9780684839790;eng
Ten Days to Self-Esteem;3.96;9780688094553;eng
The Swords of Night and Day (The Drenai Saga  #11);4.32;9780552146784;eng
Pippi Longstocking;4.13;9780142402498;eng
Pippi in the South Seas;4.11;9780670557110;en-US
Pippi Goes on Board;4.12;9780140309591;eng
The Children of Noisy Village;4.29;9780140326093;eng
The Brothers Lionheart;4.36;9781930900240;eng
Christmas in Noisy Village;4.18;9780140503449;en-US
Ronia  the Robber's Daughter;4.3;9780140317206;eng
Happy Times in Noisy Village;4.3;9781883937669;eng
Pippi Calzaslargas (Pippi Calzaslargas  #1);4.13;9788426131928;spa
The Tomten;4.24;9780698115910;eng
Lotta on Troublemaker Street;3.98;9780689846731;eng
The Tale of Peter Rabbit;4.18;9780723247708;eng
The Tale of Peter Rabbit: A Pop-up Adventure;4.18;9780723257042;en-US
Tale of Peter Rabbit;4.18;9780723249863;eng
The Tale of Peter Rabbit;4.18;9780723258735;eng
Beatrix Potter's Journal;4.36;9780723258056;eng
The World of Peter Rabbit (Original Peter Rabbit  Books 1-23);4.62;9780723257639;eng
Beatrix Potter: A Life in Nature;4.03;9780312369347;eng
The Tale of the Flopsy Bunnies;4.19;9780723247791;eng
Treasure Island;3.83;9781402713187;eng
The Epic of Gilgamesh;3.68;9780848805012;eng
The Epic of Gilgamesh;3.68;9780141026282;eng
The Epic of Gilgamesh;3.68;9780804717113;eng
The Evolution of the Gilgamesh Epic;3.82;9780865165465;eng
The Gilgamesh Epic and Old Testament Parallels;3.95;9780226323985;eng
The Scarlet Letter and Other Writings;3.59;9780393956535;eng
The Adventures of Huckleberry Finn;3.82;9781402726002;eng
The Adventures of Huckleberry Finn;3.82;9780141439648;eng
Mark Twain's Adventures of Huckleberry Finn;3.82;9780764587276;eng
Collected Tales  Sketches  Speeches  & Essays 1852–1890;4.29;9780940450363;eng
Mark Twain's Own Autobiography: The Chapters from the North American Review;3.8;9780299125400;eng
Candide;3.77;9780393960587;fre
Candide and Other Stories (World's Classics);3.94;9780192807267;en-US
Cliffs Notes on Voltaire's Candide;3.4;9780822002833;eng
Candide: or  Optimism;3.77;9780812972016;eng
Candide and Related Writings;3.8;9780872205468;fre
Philosophical Dictionary;4.09;9780140442571;en-US
What Is Goth?;4.1;9781578633227;eng
The Picture of Dorian Gray;4.08;9780321427137;eng
The Real Trial of Oscar Wilde;4.04;9780007158058;eng
Complete Shorter Fiction;4.15;9780192833761;eng
The Unmasking of Oscar Wilde;4.25;9781586170264;eng
The Decline and Fall of the Roman Empire;3.98;9780375758119;eng
The Decline and Fall of the Roman Empire;3.98;9780345478849;eng
The Decline and Fall of the Roman Empire;3.98;9780753818817;eng
The Decline and Fall of the Roman Empire;3.98;9781857151923;eng
The Christians and the Fall of Rome (Great Ideas);3.56;9780143036241;en-US
The Portable Gibbon: The Decline and Fall of the Roman Empire;3.98;9780140150605;eng
They Cage the Animals at Night;4.32;9780451159410;eng
The Quilter's Homecoming (Elm Creek Quilts  #10);4.04;9780743260220;en-US
Absolutely Normal Chaos;3.92;9780330397810;en-GB
The Abominable Snowman Doesn't Roast Marshmallows (The Adventures of the Bailey School Kids  #50);3.82;9780439650373;eng
Santa Claus Doesn't Mop Floors (The Adventures of the Bailey School Kids  #3);3.75;9780590444774;en-US
Angels Don't Know Karate (The Adventures Of The Bailey School Kids  #23);3.8;9780590849029;en-US
Werewolves Don't Run for President (The Adventures of the Bailey School Kids  #49);3.84;9780439650366;eng
Vampires Don't Wear Polka Dots (The Adventures of the Bailey School Kids  #1);3.81;9780590434119;en-US
Werewolves Don't Go to Summer Camp (The Adventures of the Bailey School Kids  #2);3.82;9780590440615;eng
Phantoms Don't Drive Sports Cars (The Adventures of the Bailey School Kids  #32);3.76;9780590189828;eng
My Perfect Life (Confessions of a Teenage Drama Queen  #2);3.32;9780763628284;eng
Be Happy or I'll Scream!: My Deranged Quest for the Perfect Husband  Family  and Life;3.71;9780312342340;en-US
A Guide to the Words of My Perfect Teacher;4.61;9781590300732;eng
All-American Girl (All-American Girl  #1);3.74;9780064472777;eng
Ready or Not (All-American Girl  #2);3.4;9780060724504;eng
Ready or Not (All-American Girl  #2);3.4;9780786282821;en-US
The Perfect Score (It's All About Attitude #5);3.24;9780373792733;eng
The Face on the Milk Carton (Janie Johnson  #1);3.73;9780385323284;eng
Teen Angst? Naaah...;3.9;9780440237679;eng
It's Kind of a Funny Story;4.13;9780786851966;eng
Be More Chill;3.68;9780786809967;eng
Collected Prose: Autobiographical Writings  True Stories  Critical Essays  Prefaces  and Collaborations with Artists;4.04;9780312424688;eng
Hand to Mouth: A Chronicle of Early Failure;3.62;9780312422325;eng
The Book of Illusions;3.85;9780571212187;eng
City of Glass: The Graphic Novel;3.93;9780571226337;eng
Moonraker;3.74;9780141187563;en-GB
Moonraker's Bride;4.31;9780285620643;eng
Eat  Pray  Love;3.55;9780143038412;eng
Eat  Pray  Love: One Woman's Search for Everything Across Italy  India and Indonesia;3.55;9781415926697;eng
The World as Will and Representation  Vol. 1;4.19;9780486217611;eng
The Schopenhauer Cure;4.22;9780060938109;eng
Essays and Aphorisms;4.17;9780140442274;eng
Essay on the Freedom of the Will;4.15;9780486440118;eng
Schopenhauer: A Very Short Introduction;3.81;9780192802590;eng
The Mandarins;4.14;9780007203949;eng
Les Mandarins: Tome 2;4.2;9782070367702;fre
Die Mandarins von Paris;4.14;9783499107610;ger
The Brothers K;4.38;9780553378498;eng
Where the Wild Things Are;4.22;9780060254926;eng
野獸國 (漢聲精選世界最佳兒童圖畫書．心理成長類  #36);4.22;9789575881047;zho
Essentials of Classic Italian Cooking;4.16;9780394584041;eng
The Italians: A Full-Length Portrait Featuring Their Manners and Morals;3.83;9780684825007;eng
Peking to Paris;3.79;9780912050263;eng
The Lost Lunar Baedeker: Poems of Mina Loy;4.17;9780374525071;eng
Paris Was Yesterday  1925-1939;3.85;9780156709903;eng
Lost Boy Lost Girl;3.48;9780449149911;eng
Shadowland;3.91;9780425188224;eng
Ghost Story;3.95;9780671685638;eng
Territoires (Le talisman des territoires  #2);4.01;9782221093832;fre
Floating Dragon;3.84;9780425189641;eng
The Color of Water: A Black Man's Tribute to His White Mother;4.09;9781594481925;en-US
Color: A Natural History of the Palette;3.78;9780812971422;en-US
Vincent's Colors;4.16;9780811850995;eng
Flinx's Folly (Pip & Flinx #9);3.94;9780345450395;eng
The Doctor's House;2.96;9780743235013;eng
Chilly Scenes of Winter;3.91;9780679732341;en-GB
What Life Was Like in the Realm of Elizabeth: England  AD 1533-1603 (What Life Was Like);3.72;9780783554563;eng
What Life Was Like In the Age of Chivalry: Medieval Europe  AD 800-1500 (What Life Was Like);3.77;9780783554518;eng
What Life Was Like on the Banks of the Nile: Egypt  3050-30 BC;4.0;9780809493784;eng
What Life Was Like at the Rebirth of Genius: Renaissance Italy  AD 1400-1550 (What Life Was Like);4.0;9780783554617;eng
What Life Was Like Among Druids and High Kings: Celtic Ireland  AD 400-1200 (What Life Was Like);3.64;9780783554556;eng
What Life Was Like Amid Splendor and Intrigue: Byzantine Empire  AD 330-1453;3.68;9780783554570;eng
What Life Was Like in the Time of War and Peace: Imperial Russia  AD 1696-1917 (What Life Was Like);3.75;9780783554594;eng
What Life Was Like in the Jewel in the Crown: British India  AD 1600-1905;3.66;34406054602;eng
Birds of America;4.11;9780312241223;eng
Self-Help;4.2;9780571145348;eng
Who Will Run the Frog Hospital?;3.79;9781400033829;eng
Family Matters;4.02;9780375703423;eng
Tales from Firozsha Baag [Jan 01  2002] Mistry  Rohinton;3.94;9780571218851;eng
"Without Remorse (John Clark  #1; Jack Ryan Universe Publication Order #6)";4.18;9780425143322;eng
Clave Red Rabbit (Jack Ryan  #2);3.67;9788408065067;spa
Debt of Honor (Jack Ryan  #7);4.05;9780425147580;eng
The Archimedes Effect (Tom Clancy's Net Force  #10);3.98;9780425204245;eng
Hidden Agendas (Tom Clancy's Net Force  #2);3.76;9780425171394;eng
Marine: A Guided Tour of a Marine Expeditionary Unit (Guided Tour);3.83;9780425154540;eng
The Teeth of the Tiger (Jack Ryan Universe  #12);3.64;9780141004921;eng
Executive Orders (Jack Ryan  #8);4.06;9780006479758;eng
State of War (Tom Clancy's Net Force  #7);3.86;9780425188132;eng
Every Man a Tiger: The Gulf War Air Campaign (Commanders);3.75;9780425207369;eng
Wild Card (Tom Clancy's Power Plays  #8);3.96;9780425199114;eng
Carrier: A Guided Tour of an Aircraft Carrier (Guided Tour);3.82;9780425166826;eng
Cloak and Dagger (Tom Clancy's Net Force Explorers  #17);4.0;9780425183038;eng
Cybernation (Tom Clancy's Net Force  #6);3.76;9780425182673;eng
Virtual Vandals (Tom Clancy's Net Force Explorers  #1);4.01;9780425161739;eng
Cutting Edge (Tom Clancy's Power Plays  #6);3.86;9780425187050;eng
Mission of Honor (Tom Clancy's Op-Center  #9);3.91;9780425186701;eng
The Bear and the Dragon (John Clark  #3);3.82;9780425180969;eng
Breaking Point (Tom Clancy's Net Force  #4);3.7;9780425176931;eng
Airborne: A Guided Tour Of An Airborne Task Force;3.77;9780425157701;eng
Red Rabbit (Jack Ryan  #2);3.67;9780399148705;eng
John Deere Farm Tractors: A History of the John Deere Tractor;4.22;9780879387556;eng
Corvette: Fifty Years;4.06;9780760320068;eng
Tough to Tackle;3.87;9780316140584;eng
Complete Guide to OneNote;4.25;9781590592168;eng
The Goon Show  Volume 4: My Knees Have Fallen Off!;5.0;9780563388692;eng
The Goon Show: Moriarty Where Are You?;4.43;9780563388548;eng
The Goon Show  Volume 11: He's Fallen in the Water!;5.0;9780563388326;eng
Power: Die 48 Gesetze Der Macht;4.18;9783423362481;ger
The Echo Maker;3.38;9780374146351;eng
Power vs. Force;4.2;9781561709335;en-US
The Power of Art;3.88;9780061176104;en-US
Goodbye  Darkness: A Memoir of the Pacific War;4.18;9780316501118;eng
A World Lit Only by Fire: The Medieval Mind and the Renaissance: Portrait of an Age;3.85;9780316545563;eng
The Last Lion 2: Winston Spencer Churchill: Alone  1932-40;4.48;9780316545129;eng
The Glory and the Dream: A Narrative History of America 1932-72;4.43;9780553345896;eng
The Last Lion: Winston Spencer Churchill: Visions of Glory  1874-1932;4.42;9780316545037;en-US
The Last Lion: Winston Spencer Churchill: Visions of Glory 1874-1932;4.42;9780385313483;eng
Moon-Flash (Kyreol  #1-2);3.74;9780142403013;eng
Harrowing the Dragon;3.94;9780441014439;eng
Cygnet (Cygnet  #1-2);4.07;9780441014835;en-US
Solstice Wood (Winter Rose  #2);3.76;9780441014651;eng
Od Magic;3.98;9780441013340;eng
25 Ways to Win with People: How to Make Others Feel Like a Million Bucks;4.11;9780785260943;eng
Winning with People Workbook;4.22;9780785260905;eng
"Thornhold (The Harpers  #16; Songs & Swords  #4)";3.67;9780786918089;eng
The Best of the Realms: The Stories of Elaine Cunningham (Forgotten Realms: The Best of the Realms  #3);3.98;9780786942886;en-GB
Changeling Storytellers Guide;3.36;9781565047082;eng
The Blood Wood (Earthdawn 6113);3.71;9781555603137;eng
Basin and Range;4.19;9780374516901;eng
The Deltoid Pumpkin Seed;3.95;9780374516352;eng
Assembling California;4.17;9780374523930;eng
Qué Se Puede Esperar Cuando Se Está Esperando;3.77;9780761136866;spa
Master of Swords (Mageverse #4);4.2;9780425209219;eng
Master of the Night (Mageverse #1);3.88;9780425198803;eng
Master of Wolves (Mageverse  #3);4.17;9780425207437;eng
Captive Dreams;3.91;9780425207758;en-US
Master of Dragons (Mageverse #5);4.22;9780425214244;eng
Master of the Moon (Mageverse #2);4.14;9780425203576;eng
Jane's Warlord (Warlord #1);3.97;9780425196847;eng
Over The Moon (Mageverse #3.5);3.9;9780425213438;eng
Mr. and Mistress (Dynasties: The Elliotts #5);3.37;9780373767236;eng
Artesia Volume 1;3.98;9781932386226;eng
Law of Enclosures;3.65;9780671003470;eng
The Drift House: The First Voyage;3.65;9781599900056;eng
Through a Brazen Mirror;3.37;9781885865243;eng
The Porcelain Dove;3.41;9780452272262;eng
Interfictions: An Anthology of Interstitial Writing;3.77;9781931520249;eng
The Fall of the Kings (Riverside  #3);3.65;9780553585940;eng
Killing Time;3.98;9780380732029;en-US
The Tangled Thread (Morland Dynasty  #10);4.32;9780751506471;eng
The Flood-Tide (Morland Dynasty  #9);4.25;9780751506464;eng
The White Road (Morland Dynasty  #28);4.27;9780751533453;eng
The Maiden (The Morland Dynasty  #8);4.27;9780751506457;eng
The Oak Apple (Morland Dynasty  #4);4.18;9780751506419;eng
The Emperor (The Morland Dynasty  #11);4.28;9780751506488;eng
The Nature of the Child;3.42;9780465048526;eng
Confessions of a Pagan Nun;3.87;9781570629136;eng
Westminster Abby;3.41;9780142404133;eng
Changelings;3.77;9780345470034;en-US
Dragon's Fire (Pern  #19);3.98;9780345480286;eng
Maelstrom;3.88;9780345470041;eng
The Mark of the Crown (Star Wars: Jedi Apprentice  #4);3.73;9780590519342;eng
The Sea;3.51;9780739333778;eng
Joy Within;4.38;9780671763794;en-US
Butch/Femme;3.62;9780517702222;eng
Expository Writing: Mini-Lessons * Strategies * Activities;4.33;9780590103879;eng
Persuasive Writing: Mini-Lessons  Strategies  Activities;3.2;9780590209342;eng
McDougal Littell Science: Student Edition Grade 6 Earth Science 2006;2.0;9780618615384;eng
Daisy Bates: Civil Rights Crusader from Arkansas;3.55;9781578068012;eng
The Loftier Way: Tales from the Ancient American Frontier;3.78;9780877477853;eng
A Higher Justice (The Trials of Kit Shannon #5);4.26;9780764226465;eng
Plot & Structure: Techniques and Exercises for Crafting a Plot That Grips Readers from Start to Finish;4.1;9781582972947;eng
Deadlock;3.96;9780310243885;eng
Breach of Promise;4.0;9780310243878;eng
Keats's Poetry and Prose;4.3;9780393924916;eng
A False Mirror (Inspector Ian Rutledge  #9);4.02;9780060786731;eng
Wings of Fire (Inspector Ian Rutledge  #2);3.99;9780312965686;eng
A Cold Treachery (Inspector Ian Rutledge  #7);4.15;9780553586619;eng
The Murder Stone;3.83;9780553586602;eng
Legacy of the Dead (Inspector Ian Rutledge  #4);4.15;9780553583151;eng
A Fearsome Doubt (Inspector Ian Rutledge  #6);4.04;9780553583175;eng
Watchers of Time (Inspector Ian Rutledge  #5);3.99;9780553583168;eng
Search the Dark (Inspector Ian Rutledge  #3);4.01;9780312971281;eng
Bill Bryson's African Diary;3.44;9780385605144;eng
Hunters of Dune (Dune Chronicles  #7);3.65;9780765312921;eng
The Battle Of Corrin (Legends of Dune  #3);3.74;9780340823378;eng
House Corrino (Prelude to Dune #3);3.68;9780553580334;eng
House Harkonnen (Prelude to Dune #2);3.67;9780553580303;eng
Doctor Who: The Inside Story;4.22;9780563486497;eng
Doctor Who Short Trips: Repercussions;3.38;9781844350483;eng
Gerontius;3.74;9781862074934;eng
Hellstrom's Hive;3.69;9780553144383;eng
The Dark City (Eliot Ness  #1);3.88;9780727862426;eng
Bullet Proof (Eliot Ness  #3);3.98;9780727862983;eng
The Penguin Companion to European Literature;4.5;9780140510355;eng
West To Eden;3.77;9780380706013;eng
The Various;3.71;9780440420293;eng
Truman Capote: In Which Various Friends  Enemies  Acquaintances  and Detractors Recall His Turbulent Career;4.08;9780385491730;eng
The Burnt Orange Heresy;3.9;9780786706686;eng
Ewan McGregor: From Junkie to Jedi;2.8;9780859652766;eng
Shadow Twin;3.57;9781596060296;eng
Der Prophet;4.23;9783530268034;ger
Le prophète;4.23;9782844541840;fre
The Complete Stories of Robert Louis Stevenson: Strange Case of Dr. Jekyll and Mr. Hyde and Nineteen Other Tales;4.13;9780375761355;eng
The Complete Short Stories Of Robert Louis Stevenson: With A Selection Of The Best Short Novels;4.21;9780306808821;eng
A Child's Garden of Verses;4.3;9780689823824;eng
Have Space Suit—Will Travel;3.9;9781416505495;eng
Practicalities;3.98;9780802133113;eng
Le ravissement de Lol V. Stein;3.66;9782070368105;fre
India Song;3.57;9780802131355;eng
Clown;3.98;9780805059335;en-US
The Spiral Stair (Arabel and Mortimer  #6);4.33;9781903015070;eng
A Near Thing for Captain Najork (Captain Najork #2);4.18;9781567923230;eng
Cover Her Face (Adam Dalgliesh #1);3.93;9780563528272;eng
Reptiles and Amphibians (Smithsonian Handbooks);4.0;9780789493934;eng
The Camera (Ansel Adams Photography  #1);4.16;9780821221846;eng
The Negative (Ansel Adams Photography  #2);4.4;9780821221860;en-US
The Print (Ansel Adams Photography  #3);4.37;9780821221877;en-US
The Changing Status of the Artist;3.93;9780300077421;eng
Vicars of Christ: A History of the Popes;3.94;9780806523705;en-US
The Big Bing: Black Holes of Time Management  Gaseous Executive Bodies  Exploding Careers  and Other Theories on the Origins of the Business Universe;3.11;9780060529574;en-US
What Would Machiavelli Do?: The Ends Justify the Meanness;3.45;9780066620107;eng
William James: In the Maelstrom of American Modernism;4.25;9780618433254;eng
Cliffs Notes on Wright's Black Boy;3.75;9780822002420;eng
The Wit and Wisdom of Abraham Lincoln: A Book of Quotations;4.15;9780486440972;eng
Speeches and Writings 1832–1858;4.36;9780940450431;eng
Selected Speeches and Writings;4.22;9780679737315;eng
George Eliot: The Last Victorian;4.05;9780815411215;eng
The Mill on the Floss;3.79;9780141439624;eng
Scenes of Clerical Life;3.78;9780192837806;eng
Terry Jones' Medieval Lives;4.02;9780563522751;eng
Terry Jones' Fairy Tales;4.25;9780140322620;eng
Some Ether;4.16;9781555973032;eng
Tin House: Evil (Volume 8 no. 3);3.9;9780977698943;eng
A Note Slipped Under the Door: Teaching from Poems We Love;4.12;9781571103208;eng
The Trouble with Testosterone and Other Essays on the Biology of the Human Predicament;4.11;9780684838915;eng
Monkeyluv: And Other Essays on Our Lives as Animals;4.17;9780743260169;en-CA
Literary Criticism  Vol. 1: Essays on Literature / American Writers / English Writers;4.26;9780940450226;eng
Advanced Statistics Demystified;4.0;9780071432429;eng
Lilly's Big Day;4.2;9780060742362;en-US
Chester's Way;4.22;9780688154721;eng
Julius  the Baby of the World;4.28;9780688143886;eng
Forms of Talk;3.81;9780812211122;eng
Interaction Ritual - Essays on Face-to-Face Behavior;4.05;9780394706313;eng
Study Bible: NIV;4.7;9780310929550;eng
My Lord Eternity (Immortal Rogues  #2);3.73;9780821775509;eng
Aesop's Fables;4.05;9780590438808;eng
Once A Wolf: How Wildlife Biologists Fought to Bring Back the Gray Wolf;4.06;9780618111206;eng
Conversations with Don DeLillo;4.06;9781578067046;en-US
Inventing America: Jefferson's Declaration of Independence;3.93;9780618257768;eng
Lincoln at Gettysburg: The Words That Remade America;4.14;9780743299633;eng
Venice: Lion City: The Religion of Empire;3.76;9780671047641;eng
Four Weddings and a Funeral;3.75;9780312143404;eng
Halloween;4.13;9780553262964;eng
Janet  My Mother and Me: A Memoir of Growing Up with Janet Flanner and Natalia Danesi Murray;3.5;9780684809663;eng
Catch That Pass!;3.91;9780316139243;eng
Divide and Conquer (Tom Clancy's Op-Center  #7);3.8;9780425174807;eng
Death Match (Tom Clancy's Net Force Explorers  #18);4.17;9780425184486;eng
Line of Control (Tom Clancy's Op-Center  #8);3.86;9780425180051;eng
Sea of Fire (Tom Clancy's Op-Center  #10);3.89;9780425190913;eng
One is the Loneliest Number (Tom Clancy's Net Force Explorers  #3);3.95;9780425164174;eng
Aliens: Nightmare Asylum;3.67;9780553561586;en-US
The Omega Cage (Matador  #4);3.78;9780441623822;eng
The 97th Step (Matador  #5);4.22;9780441581054;eng
A Friar's Bloodfeud (Knights Templar  #20);4.1;9780755323005;eng
Death Ship of Dartmouth (Knights Templar  #21);4.06;9780755323012;eng
The John Deere Two-Cylinder Tractor Encyclopedia: The Complete Model-by-Model History;4.75;9780760329634;eng
Phantoms;3.38;9780886773489;eng
Fantasy Gone Wrong;3.45;9780756403805;eng
The Ghosts in Baker Street: New Tales of Sherlock Holmes;3.58;9780786714001;en-US
Christmas Bestiary;3.62;9780886775285;eng
Black Cats and Broken Mirrors;3.38;9780886777883;eng
Time Twisters;3.36;9780756404055;eng
The Western Canon: The Books and School of the Ages;3.86;9781573225144;eng
Shakespeare: The Invention of the Human;4.02;9781573227513;eng
The American Religion;3.76;9780978721008;en-GB
American Caesar: Douglas MacArthur 1880-1964;4.15;9780316544986;eng
Winchester Shotguns;5.0;9780785821083;eng
Colossians and Philemon: A Critical and Exegetical Commentary (International Critical Commentary);5.0;9780567044716;eng
Maurice Sendak's Seven Little Monsters: What Time is It? - Book #4;2.75;9780786817788;eng
Meditations for Manifesting: Morning and Evening Meditations to Literally Create Your Heart's Desire;4.02;9781561703159;eng
There's a Spiritual Solution to Every Problem;4.27;9780060192303;eng
Michael Smith Elements of Style;4.17;9780847827626;eng
Spares;4.13;9780006512677;eng
One of Us;4.04;9780553580693;eng
The Secret City (Pyrates  #1);4.11;9780439368513;eng
The Theory and Practice of Group Psychotherapy;4.17;9780465092840;en-US
When Nietzsche Wept;4.32;9780060748128;eng
Existential Psychotherapy;4.39;9780465021475;en-US
Crown of Stars (Crown of Stars  #7);3.91;9780756404062;eng
Crown Duel (Crown & Court #1-2);4.19;9780142301517;eng
A Rose for the Crown;4.02;9780743276870;eng
The Bloody Crown of Conan (Conan the Cimmerian  #2);4.3;9780345461520;eng
